{
  "id": "11700062",
  "title": "Abbey Road",
  "type": "album",
  "artist": {
    "id": "12345",
    "name": "The Beatles",
    "url": "https://uk.7digital.com/artist/the-beatles",
    "image": "https://artwork-cdn.7static.com/static/img/artistimages/00/000/012/0000001234_350.jpg",
    "sortName": "Beatles, The"
  },
  "url": "https://uk.7digital.com/artist/the-beatles/release/abbey-road-11700062",
  "image": "https://artwork-cdn.7static.com/static/img/sleeveart/00/117/000/0011700062_350.jpg",
  "releaseDate": "1969-09-26",
  "label": "Apple Records",
  "upc": "00602445912025",
  "explicit": false
}